{
"Record_ID":1,
"Record_ID-myngl-security": "",
"Record_Date_Stamp":"datetime",
"Record_Date_Stamp-myngl-security": "",
"Bank_ID":"alphanumeric",
"Bank_ID-myngl-security": "",
"Bank_Name":"alphanumeric",
"Bank_Name-myngl-security": "",
"Bank_Address":"alphanumeric",
"Bank_Address-myngl-security": "",
"Bank_Address":"alphanumeric",
"Bank_Address-myngl-security": "",
"Bank_City":"alphanumeric",
"Bank_City-myngl-security": "",
"Bank_Zip":1,
"Bank_Zip-myngl-security": "",
"Bank_State":"alpha ",
"Bank_State-myngl-security": "",
"Customer_First_Name":"alpha",
"Customer_First_Name-myngl-security": "",
"Customer_Middle_Init":"alpha",
"Customer_Middle_Init-myngl-security": "",
"Customer_Last_Name":"alpha",
"Customer_Last_Name-myngl-security": "",
"Customer_SSN":1,
"Customer_SSN-myngl-security": "",
"Customer_Name":1,
"Customer_Name-myngl-security": "",
"Customer_Address":"alphanumeric",
"Customer_Address-myngl-security": "",
"Customer_Address":"alphanumeric",
"Customer_Address-myngl-security": "",
"Customer_City":"alphanumeric",
"Customer_City-myngl-security": "",
"Customer_Zip":1,
"Customer_Zip-myngl-security": "",
"Customer_State":"alpha ",
"Customer_State-myngl-security": "",
"Customer_Phone":"xxx-xxx-xxxx",
"Customer_Phone-myngl-security": "",
"Customer_Email":"email",
"Customer_Email-myngl-security": "",
"Bank_Account_Type_1":"alpha ",
"Bank_Account_Type_1-myngl-security": "",
"Good_Standing_Rank":1,
"Good_Standing_Rank-myngl-security": "",
"Account_Established_Date":"date",
"Account_Established_Date-myngl-security": "",
"Check_Returned_Count":1,
"Check_Returned_Count-myngl-security": "",
"Bank_Account_Type_2":"alpha ",
"Bank_Account_Type_2-myngl-security": "",
"Good_Standing_Rank":1,
"Good_Standing_Rank-myngl-security": "",
"Account_Established_Date":"date",
"Account_Established_Date-myngl-security": "",
"Check_Returned_Count":1 ,"Check_Returned_Count-myngl-security": ""

}

